{
  "source_id": "application",
  "event_name": "usage.reported",
  "event_count": 1,
  "result_sha256": "bbbbbbbbbbbbbbbbbbbbbbbbbbbbbbbbbbbbbbbbbbbbbbbbbbbbbbbbbbbbbbbb",
  "usage": {
    "aggregate_tokens": 12,
    "application_tokens": 12,
    "child_tokens": 0,
    "controller_tokens": 0,
    "cost_micros": 7
  }
}
